,date,title,url
0,"Apr 29, 2022",IT Security Researchers Meet for the 4th Franco-German Cybersecurity Workshop,/en/cispa-loria-2022
1,"Apr 29, 2022",CISPA inspires boys for the paralegal profession on Boys' Day,/en/boys-day
2,"Apr 27, 2022",How attackers can hijack machine learning models,/en/hijacking-attack
3,"Apr 20, 2022",A secure path for digital currency of central banks,/en/digital-currency
4,"Apr 13, 2022",Busy Beaver Award for CISPA Faculty Dr. Yang Zhang,/en/busy-beaver
5,"Apr 5, 2022",A new issue of TL;DR is out,/softwaresicherheit
6,"Mar 22, 2022",CISPA and St. Ingbert establish joint settlement and development company,/en/settlement-and-development-company
7,"Mar 22, 2022",CISPA PhD student Xinlei He receives coveted Norton Labs Graduate Fellowship,/en/fellowship
8,"Mar 17, 2022",CISPA Venture Capital Fund Raises 50 Million Euros,/en/vcfund
9,"Mar 17, 2022",ERC Consolidator Grant for CISPA Faculty Member Thorsten Holz,/en/erc-holz
10,"Mar 15, 2022",How small the world is,/en/graphbased-machine-learning
11,"Mar 14, 2022","""Finally putting into practice what you learned during your studies""",/en/capture-the-flag
12,"Mar 10, 2022",Extension building for CISPA ,/en/foundation-stone
13,"Mar 4, 2022",CISPA supports Science for Ukraine,/en/science-for-ukraine
14,"Mar 3, 2022",How devices learn together from distributed data,/en/federated-machine-learning
15,"Feb 28, 2022",A new issue of TL;DR is out,/en/podcast-deepfakes
16,"Feb 10, 2022",Every chain is only as strong as its weakest link,/en/blockchain-security
17,"Jan 31, 2022",Fancy a podcast? The 5th episode of TL;DR is here,/en/tldr-password-security
18,"Jan 21, 2022",One for all and all for one,/en/distributed-systems
19,"Jan 14, 2022",CISPA start-up QuantPi explains how machines think,/en/quantpi
20,"Jan 10, 2022",ERC Starting Grant for CISPA Faculty Nico Döttling,/en/erc-grant-nico-doettling
21,"Jan 7, 2022",Vaibhav Bajpai becomes Research Group Leader at CISPA's Hanover Satellite,/en/vaibhav-bajpai
22,"Jan 6, 2022",New CISPA demonstrator protects against clickjacking attacks,/en/news-and-events/news-archive/articles/2021/dr.headerson
23,"Jan 3, 2022",Episode 4 of CISPA Podcast TL;DR available now!,/en/news-and-events/news-archive/articles/2022/01.03.%20-%20Podcast%20Mridula
24,"Dec 16, 2021","Further progress in the fight against Meltdown, Spectre, and Co.",/en/news-and-events/news-archive/articles/2021/scfirefox
25,"Dec 16, 2021",CISPA start-up CodeShield develops log4jShell detection tool,/en/codeshield
26,"Dec 15, 2021",CISPA Faculty Dr. Nico Döttling Leads First Cyber Agency Feasibility Study on Encrypted Computing,/en/cyberagentur
27,"Dec 8, 2021",Tool Osiris automatically detects information leaks,/osiris
28,"Dec 6, 2021",Call for greater objectivity - statement,/en/news-and-events/news-archive/articles/2021/statement
29,"Dec 3, 2021",Strong presentations at Franco-German cybersecurity workshop,/cybersecurity-workshop
30,"Dec 2, 2021",First five CISPA faculty have successfully completed tenure track,/tenured-2021
31,"Dec 1, 2021",Episode 3 of CISPA podcast TL;DR is online!,/en/news-and-events/news-archive/articles/2021/d%C3%B6ttling
32,"Nov 26, 2021",Moritz Wilhelm wins first place at the CAST Sponsorship Award for IT security,/en/news-and-events/news-archive/articles/2021/moritz-wilhelm
33,"Nov 23, 2021","Too complex, too time-consuming, too expensive",/csp
34,"Nov 11, 2021",A dangerous game with proximity and distance,/secure-positioning
35,"Nov 8, 2021",Strategic research cooperation on cybersecurity officially opened in Hanover,/en/news-and-events/news-archive/articles/2021/cispa-hannover
36,"Nov 5, 2021",Dr. Kevin Streit is the new COO of CISPA,/en/news-and-events/news-archive/articles/2021/change-of-coo
37,"Nov 4, 2021","""The day when the work runs out will (hopefully) not come""",/en/news-and-events/news-archive/articles/2021/interview-kevin-streit
38,"Nov 3, 2021",CISPA Podcast TL;DR issue #2,/en/news-and-events/news-archive/articles/2021/staicu
39,"Oct 29, 2021",Using algorithms against cancer,/en/news-and-events/news-archive/articles/2021/machine-learning
40,"Oct 20, 2021",Who is stepping out of line here?,/en/news-and-events/news-archive/articles/2021/accountability
41,"Oct 18, 2021",The automated scientist,/en/news-and-events/news-archive/articles/2021/Alhazen
42,"Oct 8, 2021",CISPA researcher helps close security gap at cloud providers,/spectre-attack
43,"Sep 30, 2021",The first CISPA podcast TL;DR is on the air,/cispa-podcast
44,"Sep 24, 2021",Lola flies - safely and by itself,/en/news-and-events/news-archive/articles/2021/lola
45,"Sep 22, 2021",Lured into the trap via a detour,/en/news-and-events/news-archive/articles/2021/bgpeek-a-boo
46,"Sep 16, 2021","""The Luca app is immediately replaceable without any loss""",/en/news-and-events/news-archive/articles/2021/luca-app
47,"Sep 10, 2021",How secure is convenient?,/en/news-and-events/news-archive/articles/2021/voice-assistant-authentication
48,"Aug 27, 2021",It's all about who's asking,/en/news-and-events/news-archive/articles/2021/khodayari-jaw
49,"Aug 20, 2021",The battle for the credibility of our data,/en/news-and-events/news-archive/articles/2021/fritz-deepfake
50,"Aug 13, 2021","""Like a Band-Aid that doesn't stick""",/en/news-and-events/news-archive/articles/2021/stock-websecurity
51,"Aug 11, 2021",CISPA researchers present 13 papers at USENIX '21,/en/news-and-events/news-archive/articles/2021/USENIX-21
52,"Aug 6, 2021","A clean cut: the new tool ""Blade"" cuts off Spectre attacks from crypto code",/en/news-and-events/news-archive/articles/2021/vassena-blade
53,"Jul 30, 2021",No added cybersecurity through double VPN services,/en/news-and-events/news-archive/articles/2021/double-vpn
54,"Jul 22, 2021",Staying in sync,/en/news-and-events/news-archive/articles/2021/clock-synchronization
55,"Jul 21, 2021",cispa-roadshow,/en/news-and-events/news-archive/articles/2021/cispa-roadshow
56,"Jul 15, 2021",Thorsten Holz becomes CISPA faculty member,/en/news-and-events/news-archive/articles/2021/faculty-holz
57,"Jul 6, 2021",Post-quantum cryptography: How login procedures remain secure,/en/news-and-events/news-archive/articles/2021/post-quantum-cryptography
58,"Jun 30, 2021",Digital CISPA Summer School in August 2021,/en/news-and-events/news-archive/articles/2021/summer-school-2021
59,"Jun 25, 2021",Does Bluetooth need more cybersecurity?,/en/news-and-events/news-archive/articles/2021/bluetooth
60,"Jun 22, 2021",CISPA startup DeepSign among the four best security startups in Germany,/en/news-and-events/news-archive/articles/2021/deepsign
61,"Jun 18, 2021",One year Corona Warn App - a retrospective,/en/news-and-events/news-archive/articles/2021/corona-warn-app
62,"Jun 10, 2021","All-in-one interactive textbook, construction kit, and toolbox",/en/news-and-events/news-archive/articles/2021/the-debugging-book
63,"Jun 2, 2021",Who ya gonna call?,/en/news-and-events/news-archive/articles/2021/spectre
64,"May 28, 2021",It's all an act - why cookie banners should be abolished,/en/news-and-events/news-archive/articles/2021/stop-the-consent-theater
65,"May 17, 2021",Eight new top scientists to start at CISPA,/en/news-and-events/news-archive/articles/2021/05-10-21-new-facultys
66,"May 11, 2021",From herding dog to sacrificial lamb,/en/news-and-events/news-archive/articles/2021/05-11-21-solarwinds
67,"May 7, 2021",Vaccination card postings carry dangers,/en/news-and-events/news-archive/articles/2021/vaccination-posting
68,"May 6, 2021","Hooray, she is alive! - probably",/en/news-and-events/news-archive/articles/2021/quantum-computing
69,"Apr 30, 2021",Bachelor program Cybersecurity now also completely in English,/en/news-and-events/news-archive/articles/2021/bachelor-eng
70,"Apr 28, 2021",Growing pains: how to guarantee safety in systems with many components  ,/en/news-and-events/news-archive/articles/2021/safety-in-distributed-systems
71,"Apr 16, 2021",Dr. Michael Schilling wants to open up perspectives in cybersecurity for psychologists,/en/news-and-events/news-archive/articles/2021/cysec-4-psych
72,"Apr 14, 2021",Busy Beaver Awards go to Bernd Finkbeiner and Michael Schwarz,/en/news-and-events/news-archive/articles/2021/busy-beaver-award
73,"Apr 7, 2021","CISPA commits to the ""Charta der Vielfalt""",/en/news-and-events/news-archive/articles/2021/charta-der-vielfalt
74,"Apr 1, 2021",CISPA Cysec Lab has launched the Easter Challenge,/en/news-and-events/news-archive/articles/2021/Oster-Challenge
75,"Apr 1, 2021",Hidden in a tree:  How malware cleverly evades the watchful eye of scanners,/en/news-and-events/news-archive/articles/2021/HideNoSeek
76,"Mar 23, 2021",Student lab familiarizes girls with cybersecurity on Girls' Day,/en/news-and-events/news-archive/articles/2021/girls%27day-cysec-lab
77,"Mar 22, 2021",Sascha Fahl does pioneering work in Lower Saxony,/en/news-and-events/news-archive/articles/2021/cispa-satellit
78,"Mar 19, 2021",Professor Dr. Andreas Zeller receives a Most Influential Paper Award for the sixth time,/en/news-and-events/news-archive/articles/2021/zeller-most-influential-paper-award
79,"Mar 17, 2021",How Third-Party services often clash with website security mechanisms,/en/news-and-events/news-archive/articles/2021/steffens-paper-ndss
80,"Mar 8, 2021",CISPA supports public health departments in implementing contact tracing software SORMAS,/en/news-and-events/news-archive/articles/2021/sormas
81,"Mar 4, 2021",CISPA spin-off ELEXIR wins start-up competition Saarland Accelerator,/en/news-and-events/news-archive/articles/2021/elexir-accelerator
82,"Mar 3, 2021",CISPA Faculty Dr. Michael Schwarz Honored with Award of Excellence,/en/news-and-events/news-archive/articles/2021/Schwarz-Austria
83,"Mar 1, 2021",CISPA Faculty Andreas Zeller talks about opportunities for postdoctoral researchers in Germany,/en/news-and-events/news-archive/articles/2021/zeller-postdoc-germany
84,"Feb 19, 2021",What CISPA’s Sven Bugiel says about two-factor authentication and password managers,/en/news-and-events/news-archive/articles/2021/bugiel-radio-interview
85,"Feb 15, 2021","CISPA-supported start-up Foldio publishes adventure game ""Ein Fuchs im Netz""",/en/news-and-events/news-archive/articles/2021/Foldio%20Release
86,"Feb 5, 2021",Franco-German cybersecurity workshop a great success,/en/news-and-events/news-archive/articles/2021/d-frz-workshop
87,"Feb 2, 2021",CISPA Faculty Dr. Katharina Krombholz on the Whatsapp Debate,/en/news-and-events/news-archive/articles/2021/krombholz-wa
88,"Jan 6, 2021",CISPA world leader in Computer Security ,/en/news-and-events/news-archive/articles/2020/csrankings
89,"Nov 10, 2020",PLATYPUS: New vulnerabilities discovered in Intel processors discovered by team including CISPA Faculty Michael Schwarz,/en/news-and-events/news-archive/articles/2020/platypus
