,date,title,url
0,"Jan 3, 2022",Episode 4 of CISPA Podcast TL;DR available now!,/en/news-and-events/news-archive/articles/2022/01.03.%20-%20Podcast%20Mridula
1,"Dec 16, 2021","Further progress in the fight against Meltdown, Spectre, and Co.",/en/news-and-events/news-archive/articles/2021/scfirefox
2,"Dec 16, 2021",CISPA start-up CodeShield develops log4jShell detection tool,/en/codeshield
3,"Dec 15, 2021",CISPA Faculty Dr. Nico Döttling Leads First Cyber Agency Feasibility Study on Encrypted Computing,/en/cyberagentur
4,"Dec 8, 2021",Tool Osiris automatically detects information leaks,/osiris
5,"Dec 6, 2021",Call for greater objectivity - statement,/en/news-and-events/news-archive/articles/2021/statement
6,"Dec 3, 2021",Strong presentations at Franco-German cybersecurity workshop,/cybersecurity-workshop
7,"Dec 2, 2021",First five CISPA faculty have successfully completed tenure track,/tenured-2021
8,"Dec 1, 2021",Episode 3 of CISPA podcast TL;DR is online!,/en/news-and-events/news-archive/articles/2021/d%C3%B6ttling
9,"Nov 26, 2021",Moritz Wilhelm wins first place at the CAST Sponsorship Award for IT security,/en/news-and-events/news-archive/articles/2021/moritz-wilhelm
10,"Nov 23, 2021","Too complex, too time-consuming, too expensive",/csp
11,"Nov 11, 2021",A dangerous game with proximity and distance,/secure-positioning
12,"Nov 8, 2021",Strategic research cooperation on cybersecurity officially opened in Hanover,/en/news-and-events/news-archive/articles/2021/cispa-hannover
13,"Nov 5, 2021",Dr. Kevin Streit is the new COO of CISPA,/en/news-and-events/news-archive/articles/2021/change-of-coo
14,"Nov 4, 2021","""The day when the work runs out will (hopefully) not come""",/en/news-and-events/news-archive/articles/2021/interview-kevin-streit
15,"Nov 3, 2021",CISPA Podcast TL;DR issue #2,/en/news-and-events/news-archive/articles/2021/staicu
16,"Oct 29, 2021",Using algorithms against cancer,/en/news-and-events/news-archive/articles/2021/machine-learning
17,"Oct 20, 2021",Who is stepping out of line here?,/en/news-and-events/news-archive/articles/2021/accountability
18,"Oct 18, 2021",The automated scientist,/en/news-and-events/news-archive/articles/2021/Alhazen
19,"Oct 8, 2021",CISPA researcher helps close security gap at cloud providers,/spectre-attack
20,"Sep 30, 2021",The first CISPA podcast TL;DR is on the air,/cispa-podcast
21,"Sep 24, 2021",Lola flies - safely and by itself,/en/news-and-events/news-archive/articles/2021/lola
22,"Sep 22, 2021",Lured into the trap via a detour,/en/news-and-events/news-archive/articles/2021/bgpeek-a-boo
23,"Sep 16, 2021","""The Luca app is immediately replaceable without any loss""",/en/news-and-events/news-archive/articles/2021/luca-app
24,"Sep 10, 2021",How secure is convenient?,/en/news-and-events/news-archive/articles/2021/voice-assistant-authentication
25,"Aug 27, 2021",It's all about who's asking,/en/news-and-events/news-archive/articles/2021/khodayari-jaw
26,"Aug 20, 2021",The battle for the credibility of our data,/en/news-and-events/news-archive/articles/2021/fritz-deepfake
27,"Aug 13, 2021","""Like a Band-Aid that doesn't stick""",/en/news-and-events/news-archive/articles/2021/stock-websecurity
28,"Aug 11, 2021",CISPA researchers present 13 papers at USENIX '21,/en/news-and-events/news-archive/articles/2021/USENIX-21
29,"Aug 6, 2021","A clean cut: the new tool ""Blade"" cuts off Spectre attacks from crypto code",/en/news-and-events/news-archive/articles/2021/vassena-blade
30,"Jul 30, 2021",No added cybersecurity through double VPN services,/en/news-and-events/news-archive/articles/2021/double-vpn
31,"Jul 22, 2021",Staying in sync,/en/news-and-events/news-archive/articles/2021/clock-synchronization
32,"Jul 21, 2021",cispa-roadshow,/en/news-and-events/news-archive/articles/2021/cispa-roadshow
33,"Jul 15, 2021",Thorsten Holz becomes CISPA faculty member,/en/news-and-events/news-archive/articles/2021/faculty-holz
34,"Jul 6, 2021",Post-quantum cryptography: How login procedures remain secure,/en/news-and-events/news-archive/articles/2021/post-quantum-cryptography
35,"Jun 30, 2021",Digital CISPA Summer School in August 2021,/en/news-and-events/news-archive/articles/2021/summer-school-2021
36,"Jun 25, 2021",Does Bluetooth need more cybersecurity?,/en/news-and-events/news-archive/articles/2021/bluetooth
37,"Jun 22, 2021",CISPA startup DeepSign among the four best security startups in Germany,/en/news-and-events/news-archive/articles/2021/deepsign
38,"Jun 18, 2021",One year Corona Warn App - a retrospective,/en/news-and-events/news-archive/articles/2021/corona-warn-app
39,"Jun 10, 2021","All-in-one interactive textbook, construction kit, and toolbox",/en/news-and-events/news-archive/articles/2021/the-debugging-book
40,"Jun 2, 2021",Who ya gonna call?,/en/news-and-events/news-archive/articles/2021/spectre
41,"May 28, 2021",It's all an act - why cookie banners should be abolished,/en/news-and-events/news-archive/articles/2021/stop-the-consent-theater
42,"May 17, 2021",Eight new top scientists to start at CISPA,/en/news-and-events/news-archive/articles/2021/05-10-21-new-facultys
43,"May 11, 2021",From herding dog to sacrificial lamb,/en/news-and-events/news-archive/articles/2021/05-11-21-solarwinds
44,"May 7, 2021",Vaccination card postings carry dangers,/en/news-and-events/news-archive/articles/2021/vaccination-posting
45,"May 6, 2021","Hooray, she is alive! - probably",/en/news-and-events/news-archive/articles/2021/quantum-computing
46,"Apr 30, 2021",Bachelor program Cybersecurity now also completely in English,/en/news-and-events/news-archive/articles/2021/bachelor-eng
47,"Apr 28, 2021",Growing pains: how to guarantee safety in systems with many components  ,/en/news-and-events/news-archive/articles/2021/safety-in-distributed-systems
48,"Apr 16, 2021",Dr. Michael Schilling wants to open up perspectives in cybersecurity for psychologists,/en/news-and-events/news-archive/articles/2021/cysec-4-psych
49,"Apr 14, 2021",Busy Beaver Awards go to Bernd Finkbeiner and Michael Schwarz,/en/news-and-events/news-archive/articles/2021/busy-beaver-award
50,"Apr 7, 2021","CISPA commits to the ""Charta der Vielfalt""",/en/news-and-events/news-archive/articles/2021/charta-der-vielfalt
51,"Apr 1, 2021",CISPA Cysec Lab has launched the Easter Challenge,/en/news-and-events/news-archive/articles/2021/Oster-Challenge
52,"Apr 1, 2021",Hidden in a tree:  How malware cleverly evades the watchful eye of scanners,/en/news-and-events/news-archive/articles/2021/HideNoSeek
53,"Mar 23, 2021",Student lab familiarizes girls with cybersecurity on Girls' Day,/en/news-and-events/news-archive/articles/2021/girls%27day-cysec-lab
54,"Mar 22, 2021",Sascha Fahl does pioneering work in Lower Saxony,/en/news-and-events/news-archive/articles/2021/cispa-satellit
55,"Mar 19, 2021",Professor Dr. Andreas Zeller receives a Most Influential Paper Award for the sixth time,/en/news-and-events/news-archive/articles/2021/zeller-most-influential-paper-award
56,"Mar 17, 2021",How Third-Party services often clash with website security mechanisms,/en/news-and-events/news-archive/articles/2021/steffens-paper-ndss
57,"Mar 8, 2021",CISPA supports public health departments in implementing contact tracing software SORMAS,/en/news-and-events/news-archive/articles/2021/sormas
58,"Mar 4, 2021",CISPA spin-off ELEXIR wins start-up competition Saarland Accelerator,/en/news-and-events/news-archive/articles/2021/elexir-accelerator
59,"Mar 3, 2021",CISPA Faculty Dr. Michael Schwarz Honored with Award of Excellence,/en/news-and-events/news-archive/articles/2021/Schwarz-Austria
60,"Mar 1, 2021",CISPA Faculty Andreas Zeller talks about opportunities for postdoctoral researchers in Germany,/en/news-and-events/news-archive/articles/2021/zeller-postdoc-germany
61,"Feb 19, 2021",What CISPA’s Sven Bugiel says about two-factor authentication and password managers,/en/news-and-events/news-archive/articles/2021/bugiel-radio-interview
62,"Feb 15, 2021","CISPA-supported start-up Foldio publishes adventure game ""Ein Fuchs im Netz""",/en/news-and-events/news-archive/articles/2021/Foldio%20Release
63,"Feb 5, 2021",Franco-German cybersecurity workshop a great success,/en/news-and-events/news-archive/articles/2021/d-frz-workshop
64,"Feb 2, 2021",CISPA Faculty Dr. Katharina Krombholz on the Whatsapp Debate,/en/news-and-events/news-archive/articles/2021/krombholz-wa
65,"Jan 6, 2021",CISPA world leader in Computer Security ,/en/news-and-events/news-archive/articles/2020/csrankings
66,"Nov 10, 2020",PLATYPUS: New vulnerabilities discovered in Intel processors discovered by team including CISPA Faculty Michael Schwarz,/en/news-and-events/news-archive/articles/2020/platypus
67,"Oct 29, 2020",Cas Cremers at Falling Walls 2020,/en/news-and-events/news-archive/articles/2020/falling-walls-2020
68,"Oct 20, 2020",CISPA collaborates with Leibniz Universität Hannover and Niedersachsen,/en/news-and-events/news-archive/articles/2020/cispa-x-niedersachsen-2020
69,"Oct 6, 2020",CISPA Innovation Campus to be located in St. Ingbert,/en/news-and-events/news-archive/articles/2020/cispa-innovation-campus-st-ingbert
70,"Jul 9, 2020",Virtual cohorts for medical research,/en/news-and-events/news-archive/articles/2020/pro-gene-gen
71,"Jun 23, 2020",Professor Dr. Cas Cremers about his work on Corona Warn App and the role of CISPA in this project,/en/news-and-events/news-archive/articles/2020/cremers-about-the-coronawarnapp
72,"Jun 15, 2020",Corona-Warn-App: Thank you for your work,/en/news-and-events/news-archive/articles/2020/corona-warn-app-thank-you-for-your-work
73,"May 25, 2020",Rayna Dimitrova becomes CISPA Faculty,/en/news-and-events/news-archive/articles/2020/rayna-dimitrova-becomes-cispa-faculty
74,"May 11, 2020","Schwarz, Staicu and Hanzlik - Three new faculty set to start at CISPA",/en/news-and-events/news-archive/articles/2020/three-new-faculty-set-to-start-at-cispa
75,"Apr 26, 2020",CISPA and Helmholtz welcome the Federal government's change of course regarding coronavirus app,/en/news-and-events/news-archive/articles/2020/cispa-and-helmholtz-welcome-the-federal-governments-change-of-course-regarding-coronavirus-app
76,"Apr 20, 2020",Joint Statement on Contact Tracing,/en/news-and-events/news-archive/articles/2020/joint-statement-on-contact-tracing
77,"Apr 20, 2020",Contact Tracing App for the SARS-CoV-2 pandemic,/en/news-and-events/news-archive/articles/2020/contact-tracing-app-for-the-sars-cov-2-pandemic
78,"Apr 3, 2020",Hidden functions make mobile phone apps vulnerable to hackers,/en/news-and-events/news-archive/articles/2020/hidden-functions-make-mobile-phone-apps-vulnerable-to-hackers
79,"Mar 19, 2020",Andreas Zeller and Bernd Finkbeiner awarded the state prize for university teaching,/en/news-and-events/news-archive/articles/2020/andreas-zeller-and-bernd-finkbeiner-awarded-the-state-prize-for-university-teaching
80,"Mar 17, 2020",Important questions and answers on CISPA during the Corona Pandemic,/en/news-and-events/news-archive/articles/2020/important-questions-and-answers-on-working-on-cispa-during-the-corona-pandemic
81,"Mar 9, 2020",Dániel Marx to become Faculty at CISPA,/en/news-and-events/news-archive/articles/2020/daniel-marx-to-become-faculty-at-cispa
82,"Mar 5, 2020",Security teams now backed with more than 3 million euros through CISPA,/en/news-and-events/news-archive/articles/2020/security-teams-now-backed-with-more-than-3-million-euros-through-cispa
83,"Jan 20, 2020",CISPA and LORIA open new French-German Center for Cybersecurity,/en/news-and-events/news-archive/articles/2020/cispa-and-loria-open-new-french-german-center-for-cybersecurity
84,"Jan 16, 2020",Yang Zhang to become Faculty at CISPA Helmholtz Center for Information Security,/en/news-and-events/news-archive/articles/2020/yang-zhang-to-become-faculty
85,"Oct 29, 2019",Pellegrino and Joux to become Faculty at CISPA Helmholtz Center for Information Security,/en/news-and-events/news-archive/articles/2019/pellegrino-and-joux-become-faculty
86,"Oct 29, 2019",CISPA now hiring new faculty,/en/news-and-events/news-archive/articles/2019/faculty-hiring
87,"Aug 29, 2019",New Cooperation with Korean Partners in the Field of Cyber Security,/en/news-and-events/news-archive/articles/2019/cooperation-with-kaist
88,"Aug 28, 2019",IACR Test-of-Time Award for Antoine Joux,/en/news-and-events/news-archive/articles/2019/iacr-test-of-time-award-antoine-joux
89,"Jun 5, 2019",Meeting of the Supervisory Board,/en/news-and-events/news-archive/articles/2019/meeting-supervisory-board
