,date,title,url
0,"Aug 20, 2021",fritz-deepfake,/en/news-and-events/news-archive/articles/2021/fritz-deepfake
1,"Aug 13, 2021","""Like a Band-Aid that doesn't stick""",/en/news-and-events/news-archive/articles/2021/stock-websecurity
2,"Aug 11, 2021",CISPA researchers present 13 papers at USENIX '21,/en/news-and-events/news-archive/articles/2021/USENIX-21
3,"Aug 6, 2021","A clean cut: the new tool ""Blade"" cuts off Spectre attacks from crypto code",/en/news-and-events/news-archive/articles/2021/vassena-blade
4,"Jul 30, 2021",No added cybersecurity through double VPN services,/en/news-and-events/news-archive/articles/2021/double-vpn
5,"Jul 22, 2021",Staying in sync,/en/news-and-events/news-archive/articles/2021/clock-synchronization
6,"Jul 21, 2021",cispa-roadshow,/en/news-and-events/news-archive/articles/2021/cispa-roadshow
7,"Jul 15, 2021",Thorsten Holz becomes CISPA faculty member,/en/news-and-events/news-archive/articles/2021/faculty-holz
8,"Jul 6, 2021",Post-quantum cryptography: How login procedures remain secure,/en/news-and-events/news-archive/articles/2021/post-quantum-cryptography
9,"Jun 30, 2021",Digital CISPA Summer School in August 2021,/en/news-and-events/news-archive/articles/2021/summer-school-2021
10,"Jun 25, 2021",Does Bluetooth need more cybersecurity?,/en/news-and-events/news-archive/articles/2021/bluetooth
11,"Jun 22, 2021",CISPA startup DeepSign among the four best security startups in Germany,/en/news-and-events/news-archive/articles/2021/deepsign
12,"Jun 18, 2021",One year Corona Warn App - a retrospective,/en/news-and-events/news-archive/articles/2021/corona-warn-app
13,"Jun 10, 2021","All-in-one interactive textbook, construction kit, and toolbox",/en/news-and-events/news-archive/articles/2021/spectre/the-debugging-book
14,"Jun 2, 2021",Who ya gonna call?,/en/news-and-events/news-archive/articles/2021/spectre
15,"May 28, 2021",It's all an act - why cookie banners should be abolished,/en/news-and-events/news-archive/articles/2021/stop-the-consent-theater
16,"May 17, 2021",Eight new top scientists to start at CISPA,/en/news-and-events/news-archive/articles/2021/05-10-21-new-facultys
17,"May 11, 2021",From herding dog to sacrificial lamb,/en/news-and-events/news-archive/articles/2021/05-11-21-solarwinds
18,"May 7, 2021",Vaccination card postings carry dangers,/en/news-and-events/news-archive/articles/2021/vaccination-posting
19,"Apr 30, 2021",Bachelor program Cybersecurity now also completely in English,/en/news-and-events/news-archive/articles/2021/bachelor-eng
20,"Apr 28, 2021",Growing pains: how to guarantee safety in systems with many components  ,/en/news-and-events/news-archive/articles/2021/safety-in-distributed-systems
21,"Apr 16, 2021",Dr. Michael Schilling wants to open up perspectives in cybersecurity for psychologists,/en/news-and-events/news-archive/articles/2021/cysec-4-psych
22,"Apr 14, 2021",Busy Beaver Awards go to Bernd Finkbeiner and Michael Schwarz,/en/news-and-events/news-archive/articles/2021/busy-beaver-award
23,"Apr 7, 2021","CISPA commits to the ""Charta der Vielfalt""",/en/news-and-events/news-archive/articles/2021/charta-der-vielfalt
24,"Apr 1, 2021",CISPA Cysec Lab has launched the Easter Challenge,/en/news-and-events/news-archive/articles/2021/Oster-Challenge
25,"Apr 1, 2021",Hidden in a tree:  How malware cleverly evades the watchful eye of scanners,/en/news-and-events/news-archive/articles/2021/HideNoSeek
26,"Mar 23, 2021",Student lab familiarizes girls with cybersecurity on Girls' Day,/en/news-and-events/news-archive/articles/2021/girls%27day-cysec-lab
27,"Mar 22, 2021",Sascha Fahl does pioneering work in Lower Saxony,/en/news-and-events/news-archive/articles/2021/cispa-satellit
28,"Mar 19, 2021",Professor Dr. Andreas Zeller receives a Most Influential Paper Award for the sixth time,/en/news-and-events/news-archive/articles/2021/zeller-most-influential-paper-award
29,"Mar 17, 2021",How Third-Party services often clash with website security mechanisms,/en/news-and-events/news-archive/articles/2021/steffens-paper-ndss
30,"Mar 8, 2021",CISPA supports public health departments in implementing contact tracing software SORMAS,/en/news-and-events/news-archive/articles/2021/sormas
31,"Mar 4, 2021",CISPA spin-off ELEXIR wins start-up competition Saarland Accelerator,/en/news-and-events/news-archive/articles/2021/elexir-accelerator
32,"Mar 3, 2021",CISPA Faculty Dr. Michael Schwarz Honored with Award of Excellence,/en/news-and-events/news-archive/articles/2021/Schwarz-Austria
33,"Mar 1, 2021",CISPA Faculty Andreas Zeller talks about opportunities for postdoctoral researchers in Germany,/en/news-and-events/news-archive/articles/2021/zeller-postdoc-germany
34,"Feb 19, 2021",What CISPA’s Sven Bugiel says about two-factor authentication and password managers,/en/news-and-events/news-archive/articles/2021/bugiel-radio-interview
35,"Feb 15, 2021","CISPA-supported start-up Foldio publishes adventure game ""Ein Fuchs im Netz""",/en/news-and-events/news-archive/articles/2021/Foldio%20Release
36,"Feb 5, 2021",Franco-German cybersecurity workshop a great success,/en/news-and-events/news-archive/articles/2021/d-frz-workshop
37,"Feb 2, 2021",CISPA Faculty Dr. Katharina Krombholz on the Whatsapp Debate,/en/news-and-events/news-archive/articles/2021/krombholz-wa
38,"Jan 6, 2021",CISPA world leader in Computer Security ,/en/news-and-events/news-archive/articles/2020/csrankings
39,"Nov 10, 2020",PLATYPUS: New vulnerabilities discovered in Intel processors discovered by team including CISPA Faculty Michael Schwarz,/en/news-and-events/news-archive/articles/2020/platypus
40,"Oct 29, 2020",Cas Cremers at Falling Walls 2020,/en/news-and-events/news-archive/articles/2020/falling-walls-2020
41,"Oct 20, 2020",CISPA collaborates with Leibniz Universität Hannover and Niedersachsen,/en/news-and-events/news-archive/articles/2020/cispa-x-niedersachsen-2020
42,"Oct 6, 2020",CISPA Innovation Campus to be located in St. Ingbert,/en/news-and-events/news-archive/articles/2020/cispa-innovation-campus-st-ingbert
43,"Jul 9, 2020",Virtual cohorts for medical research,/en/news-and-events/news-archive/articles/2020/pro-gene-gen
44,"Jun 23, 2020",Professor Dr. Cas Cremers about his work on Corona Warn App and the role of CISPA in this project,/en/news-and-events/news-archive/articles/2020/cremers-about-the-coronawarnapp
45,"Jun 15, 2020",Corona-Warn-App: Thank you for your work,/en/news-and-events/news-archive/articles/2020/corona-warn-app-thank-you-for-your-work
46,"May 25, 2020",Rayna Dimitrova becomes CISPA Faculty,/en/news-and-events/news-archive/articles/2020/rayna-dimitrova-becomes-cispa-faculty
47,"May 11, 2020","Schwarz, Staicu and Hanzlik - Three new faculty set to start at CISPA",/en/news-and-events/news-archive/articles/2020/three-new-faculty-set-to-start-at-cispa
48,"Apr 26, 2020",CISPA and Helmholtz welcome the Federal government's change of course regarding coronavirus app,/en/news-and-events/news-archive/articles/2020/cispa-and-helmholtz-welcome-the-federal-governments-change-of-course-regarding-coronavirus-app
49,"Apr 20, 2020",Joint Statement on Contact Tracing,/en/news-and-events/news-archive/articles/2020/joint-statement-on-contact-tracing
50,"Apr 20, 2020",Contact Tracing App for the SARS-CoV-2 pandemic,/en/news-and-events/news-archive/articles/2020/contact-tracing-app-for-the-sars-cov-2-pandemic
51,"Apr 3, 2020",Hidden functions make mobile phone apps vulnerable to hackers,/en/news-and-events/news-archive/articles/2020/hidden-functions-make-mobile-phone-apps-vulnerable-to-hackers
52,"Mar 19, 2020",Andreas Zeller and Bernd Finkbeiner awarded the state prize for university teaching,/en/news-and-events/news-archive/articles/2020/andreas-zeller-and-bernd-finkbeiner-awarded-the-state-prize-for-university-teaching
53,"Mar 17, 2020",Important questions and answers on CISPA during the Corona Pandemic,/en/news-and-events/news-archive/articles/2020/important-questions-and-answers-on-working-on-cispa-during-the-corona-pandemic
54,"Mar 9, 2020",Dániel Marx to become Faculty at CISPA,/en/news-and-events/news-archive/articles/2020/daniel-marx-to-become-faculty-at-cispa
55,"Mar 5, 2020",Security teams now backed with more than 3 million euros through CISPA,/en/news-and-events/news-archive/articles/2020/security-teams-now-backed-with-more-than-3-million-euros-through-cispa
56,"Jan 20, 2020",CISPA and LORIA open new French-German Center for Cybersecurity,/en/news-and-events/news-archive/articles/2020/cispa-and-loria-open-new-french-german-center-for-cybersecurity
57,"Jan 16, 2020",Yang Zhang to become Faculty at CISPA Helmholtz Center for Information Security,/en/news-and-events/news-archive/articles/2020/yang-zhang-to-become-faculty
58,"Oct 29, 2019",Pellegrino and Joux to become Faculty at CISPA Helmholtz Center for Information Security,/en/news-and-events/news-archive/articles/2019/pellegrino-and-joux-become-faculty
59,"Oct 29, 2019",CISPA now hiring new faculty,/en/news-and-events/news-archive/articles/2019/faculty-hiring
60,"Aug 29, 2019",New Cooperation with Korean Partners in the Field of Cyber Security,/en/news-and-events/news-archive/articles/2019/cooperation-with-kaist
61,"Aug 28, 2019",IACR Test-of-Time Award for Antoine Joux,/en/news-and-events/news-archive/articles/2019/iacr-test-of-time-award-antoine-joux
62,"Jun 5, 2019",Meeting of the Supervisory Board,/en/news-and-events/news-archive/articles/2019/meeting-supervisory-board
63,"Apr 30, 2019",A new cooperation with top research institutes in China,/en/news-and-events/news-archive/articles/2019/new-cooperation-with-top-research-institutes-in-china
64,"Apr 8, 2019",CISPA Incubator Advisory Board Meeting,/en/news-and-events/news-archive/articles/2019/cispa-advisory-board-meeting
65,"Apr 1, 2019",Security Convention at CISPA,/en/news-and-events/news-archive/articles/2019/security-convention-at-cispa
66,"Feb 28, 2019",Distinguished Paper Award at NDSS,/en/news-and-events/news-archive/articles/2019/distinguished-paper-award-ndss
67,"Feb 14, 2019",CISPA Researcher receives SRL Graduate Fellowship,/en/news-and-events/news-archive/articles/2019/cispa-researcher-receives-srl-graduate-fellowship
68,"Feb 5, 2019",Roadmap of Cybersecurity Research Presented in Brussels,/en/news-and-events/news-archive/articles/2019/roadmap-cybersecurity-research-brussels
69,"Feb 5, 2019",CISPA now hiring new faculty,/en/news-and-events/news-archive/articles/2019/fm-karliczek-visit-cispa
70,"Dec 14, 2018",Article on staatlichen Umgang mit IT-Sicherheitslücken,/en/news-and-events/news-archive/articles/2018/article-staatlicher-umgang-sicherheitsluecken
71,"Nov 27, 2018",CISPA and DZNE founding the Helmholtz Medical Security and Privacy Research Center,/en/news-and-events/news-archive/articles/2018/cispa-dzne-found-helmholtz-medical-security-and-privacy-research-center
72,"Nov 22, 2018",Michael Backes is named IEEE Fellow,/en/news-and-events/news-archive/articles/2018/michael-backes-named-ieee-fellow
73,"Nov 20, 2018",Jilles Vreeken receives IEEE ICDM 2018 Awards,/en/news-and-events/news-archive/articles/2018/vreeken-ieee-icdm-award
74,"Nov 9, 2018",Cooperation Agreement between CISPA and Saarland University,/en/news-and-events/news-archive/articles/2018/cooperation-agreement-between-cispa-and-saarland-university
75,"Oct 26, 2018",German-French PhD Workshop on „Big Secure Data“,/en/news-and-events/news-archive/articles/2018/german-french-phd-atelier
76,"Oct 11, 2018",CISPA and Symantec at it-sa 2018,/en/news-and-events/news-archive/articles/2018/cispa-symantec-itsa
77,"Oct 11, 2018",Visit of the Dutch Royal Couple,/en/news-and-events/news-archive/articles/2018/dutch-royal-couple-visit
78,"Oct 2, 2018",Michael Backes receives honorary doctorate,/en/news-and-events/news-archive/articles/2018/michaels-ehrendoktor
79,"Sep 12, 2018",Helmholtz Center for Information Security (CISPA),/en/news-and-events/news-archive/articles/2018/cispa-helmholtz-center-official-approval
80,"Sep 10, 2018",Bitcoin: How users betray the security secrets of their virtual purse,/en/news-and-events/news-archive/articles/2018/btc-keyleakage
81,"Aug 14, 2018",Saarbrucken computer scientists automate attacks against the second largest cryptocurrency,/en/news-and-events/news-archive/articles/2018/teether
82,"Jun 8, 2018",CEBIT 2018: Artificial intelligence warns of photos that show more than desired,/en/news-and-events/news-archive/articles/2018/cebit-2018-artificial-intelligence-warns-of-photos-that-show-more-than-desired
83,"Jun 8, 2018",CEBIT 2018: Intelligent mass testing for better IT security,/en/news-and-events/news-archive/articles/2018/cebit-2018-intelligent-mass-testing-for-greater-it-security
84,"Jun 8, 2018",CEBIT 2018: IT security experts from Saarbrücken uncover how apps really behave,/en/news-and-events/news-archive/articles/2018/cebit-2018-it-security-experts-from-saarbruecken-uncover-how-apps-really-behave
85,"Jun 8, 2018",Cebit 2018: New course of study combines IT security with company foundation,/en/news-and-events/news-archive/articles/2018/cebit-2018-new-course-entrepreneurial-cybersecurity
86,"Jun 8, 2018",CEBIT 2018: Researchers expose perpetrators behind mass Internet attacks,/en/news-and-events/news-archive/articles/2018/cebit-2018-researchers-expose-perpetrators-behind-mass-internet-attacks
87,"Jun 8, 2018",CEBIT 2018: Who controls the Internet? And what does a global security update for e-mails actually cost?,/en/news-and-events/news-archive/articles/2018/cebit-2018-who-controls-the-internet-and-what-does-a-global-security-update-for-e-mails-actually-cost
88,"Apr 27, 2018",Prestigious prize for research on software technology goes to Germany for the first time,/en/news-and-events/news-archive/articles/2018/andreas-zeller-acm-award
89,"Dec 13, 2017",We · are · founded!,/en/news-and-events/news-archive/articles/2017/cispa-helmholtz-center-i-g-is-founded
