,date,title,url
0,"May 15, 2023",Most Influential Paper Award for CISPA Faculty Andreas Zeller ,/en/mip-award-zeller
1,"May 8, 2023",Password manager security with Nicolas Huaman Groschopf,/en/episode-20-tldr
2,"May 5, 2023",CISPA researcher Christoph Lenzen again receives Proof of Concept Grant from ERC,/en/erc-grant-lenzen
3,"May 4, 2023","„At CISPA, you’re a full-fledged researcher from the beginning“",/en/interview_phd_sebastianroth
4,"May 2, 2023",Six new top researchers to join CISPA,/en/news-and-events/news-archive/articles/2023/new_faculty_1_2023
5,"Apr 27, 2023",CISPA spotlights career opportunities for young people at Girls' Day and Boys' Day,/en/girls-and-boys-day-2023
6,"Apr 21, 2023",CISPA Faculty Dr Mridula Singh receives Busy Beaver Award,/en/busy-beaver-singh
7,"Apr 18, 2023","„If you control the input as well as the output, you control the program.“",/en/input-invariants
8,"Apr 14, 2023",CISPA Faculty Pellegrino and Zhang are awarded tenure,/en/new_tenured_faculty_pellegrino-zhang
9,"Apr 11, 2023",CISPA researchers develop open-source prototype for 2-factor authentication,/en/FeIDo-prototype-2-factor-authentication
10,"Apr 5, 2023","""At CISPA, you always have an expert by your side""",/en/phd-students
11,"Apr 3, 2023",Generating Software Tests with Prof. Dr. Andreas Zeller,/en/episode-19-tldr
12,"Mar 30, 2023",Prof. Dr. Andreas Zeller receives another ERC Grant,/en/erc-grant-andreas-zeller
13,"Mar 10, 2023",An unwinnable game,/en/an-unwinnable-game
14,"Mar 2, 2023",Episode 18 of CISPA TL;DR is online,/en/episode-18-TLDR
15,"Feb 24, 2023",Know your enemy,/en/know-your-enemy
16,"Feb 15, 2023",HIPS and CISPA join forces to make future active ingredients safer,/en/imagetox
17,"Feb 10, 2023",Why visual digital certificates are only secure in theory (so far),/en/certificates
18,"Feb 7, 2023",Summer School 2023,/summer-school
19,"Feb 2, 2023",PriSyn project makes medical data securely usable,/en/prisyn-project
20,"Feb 1, 2023",CISPA in Hanover with Prof. Dr. Sascha Fahl,/en/Episode-17-TLDR
21,"Jan 16, 2023",Pure Speculation,/en/pure-speculation
22,"Jan 5, 2023",Security of Open Source Software with Dominik Wermke ,/en/news-and-events/news-archive/articles/2023/podcast-wermke
23,"Jan 2, 2023",The Pinnacle of research and business,/en/cispa-tech-transfer
24,"Dec 22, 2022","""Students have so many opportunities to develop""",/en/ben-stock-interview
25,"Dec 21, 2022",Putting software on the test bench,/en/putting-software-on-the-test-bench
26,"Dec 14, 2022",Under the radar,/en/under-the-radar
27,"Dec 12, 2022",Exciting Insights at the Airbus CISPA Day,/en/airbus-cispa-day-2022
28,"Dec 7, 2022",Machine Learning with Dr. Rebekka Burkholz,/en/podcast-machine-learning
29,"Dec 5, 2022",The security lottery,/en/security-lottery
30,"Dec 2, 2022",“We will be at a disadvantage if we don’t build our skills and knowledge about AI-Tools.”,/en/tejumade-afonja-interview
31,"Nov 29, 2022","""Together, we make the world a better and safer place""",/en/interview-evert-dudok
32,"Nov 9, 2022",Side-Channel Attacks with Dr. Michael Schwarz und Andreas Kogler,/en/tldr-episode-14
33,"Nov 8, 2022",Airbus CISPA Day at Saarland University,/en/airbus-cispa
34,"Nov 7, 2022",Busy Beaver Award Once Again for CISPA Faculty Michael Schwarz,/en/busy-beaver-award
35,"Oct 25, 2022",ELSA network celebrates official launch in Barcelona,/en/elsa-kickoff
36,"Oct 19, 2022",5th French-German Cybersecurity Workshop brings together IT security researchers from both countries at CISPA,/en/german-french-workshop
37,"Oct 18, 2022",Science meets Entertainment at the CISPA Cyber Days,/en/cispa-cyber-days
38,"Oct 13, 2022",Anti-stalkerware: Expectations and reality,/en/anti-stalkerware
39,"Oct 4, 2022",Artificial Intelligence with Prof. Dr. Mario Fritz,/en/podcast-fritz
40,"Sep 9, 2022",Are we on the same site?,/en/samesite
41,"Sep 6, 2022",Security of open source software,/en/oss-security
42,"Sep 2, 2022",Causality in Machine Learning with Osman Ali Mian ,/tldr-episode-12
43,"Aug 31, 2022",Meta Research funds work of CISPA researcher Dr. Sebastian Stich,/en/algorithms
44,"Aug 25, 2022",Qualcomm Fellowship for CISPA researcher Dingfan Chen,/en/qualcomm-fellowship
45,"Aug 12, 2022",CISPA at USENIX 2022 – Friday,/en/cispa-usenix
46,"Aug 11, 2022",CISPA at USENIX 2022 – Thursday,/en/usenix22-thursday
47,"Aug 10, 2022",CISPA at USENIX 2022 – Wednesday,/en/usenix22-wednesday
48,"Aug 9, 2022",Dramatic vulnerability discovered in Intel processors,/en/aepic
49,"Aug 8, 2022",ERC Advanced Grant for Prof. Bernd Finkbeiner,/en/erc-grant-hyper
50,"Aug 2, 2022",Usable Security with Dr. Katharina Krombholz,/en/tldr-episode-11
51,"Aug 1, 2022",10 million euros of funding for the development of the virtual center of excellence ELSA ,/en/elsa
52,"Jul 27, 2022","""I chose science – because of the freedom researchers enjoy”",/en/interview-thorsten-holz
53,"Jul 18, 2022","""We finally want to dig up this treasure of data and make it usable without having to give up data privacy""",/en/nico-doettling
54,"Jul 15, 2022",CISPA expert for trustworthy AI helps with analysis of patient data,/en/trustworthy-ai
55,"Jul 11, 2022",Summer School 2022,/en/summer-school-2022
56,"Jul 4, 2022",LOKI - Local Early Warning System for Control of Infection Outbreaks,/en/loki
57,"Jul 4, 2022",How machines learn to forget,/en/machine-unlearning
58,"Jul 1, 2022",Provable Security of Mix Networks with Dr. Julian Loss,/en/tldr-episode-10
59,"Jun 22, 2022",Airbus and CISPA establish Digital Innovation Hub for Cybersecurity and Artificial Intelligence,/en/cispa-airbus
60,"Jun 15, 2022",CISPA Supervisory Board welcomes Minister-President Anke Rehlinger as new member,/en/supervisory-board
61,"Jun 13, 2022",Web3 Foundation funds work of CISPA faculty Dr. Julian Loss,/en/dmna
62,"Jun 9, 2022",Dr. Ali Abbasi to become new CISPA faculty member,/en/ali-abbasi-22
63,"Jun 3, 2022",Xiao Zhang to become new CISPA faculty member,/en/xiao-zhang-22
64,"Jun 2, 2022",Browser Extension Security with Dr. Aurore Fass,/en/tldr-browser-extensions
65,"May 30, 2022",Dr. Lea Schönherr to become new CISPA faculty member,/en/schoenherr22
66,"May 26, 2022",Krikamol Muandet to become new CISPA faculty member,/en/krikamol22
67,"May 25, 2022","""Encrypted-Computing-Compass"" project celebrates first milestone",/en/encrypted-computing
68,"May 24, 2022",Dr. Wouter Lueks becomes new CISPA faculty member,/en/lueks22
69,"May 23, 2022",Much interest in CISPA's open day,/open-door-2022
70,"May 4, 2022",Companies often lack sufficient awareness of cybersecurity risks,/en/sme-security
71,"May 3, 2022",New episode of TL;DR – Security of Web Applications with Dr. Giancarlo Pellegrino,/en/podcast-pellegrino
72,"Apr 29, 2022",IT Security Researchers Meet for the 4th Franco-German Cybersecurity Workshop,/en/cispa-loria-2022
73,"Apr 29, 2022",CISPA inspires boys for the paralegal profession on Boys' Day,/en/boys-day
74,"Apr 27, 2022",How attackers can hijack machine learning models,/en/hijacking-attack
75,"Apr 20, 2022",A secure path for digital currency of central banks,/en/digital-currency
76,"Apr 13, 2022",Busy Beaver Award for CISPA Faculty Dr. Yang Zhang,/en/busy-beaver
77,"Apr 5, 2022",A new issue of TL;DR is out,/softwaresicherheit
78,"Mar 22, 2022",CISPA and St. Ingbert establish joint settlement and development company,/en/settlement-and-development-company
79,"Mar 22, 2022",CISPA PhD student Xinlei He receives coveted Norton Labs Graduate Fellowship,/en/fellowship
80,"Mar 17, 2022",CISPA Venture Capital Fund Raises 50 Million Euros,/en/vcfund
81,"Mar 17, 2022",ERC Consolidator Grant for CISPA Faculty Member Thorsten Holz,/en/erc-holz
82,"Mar 15, 2022",How small the world is,/en/graphbased-machine-learning
83,"Mar 14, 2022","""Finally putting into practice what you learned during your studies""",/en/capture-the-flag
84,"Mar 10, 2022",Extension building for CISPA ,/en/foundation-stone
85,"Mar 4, 2022",CISPA supports Science for Ukraine,/en/science-for-ukraine
86,"Mar 3, 2022",How devices learn together from distributed data,/en/federated-machine-learning
87,"Feb 28, 2022",A new issue of TL;DR is out,/en/podcast-deepfakes
88,"Feb 10, 2022",Every chain is only as strong as its weakest link,/en/blockchain-security
89,"Jan 31, 2022",Fancy a podcast? The 5th episode of TL;DR is here,/en/tldr-password-security
